{
  "action_packet": {
    "D1_identity": {
      "actor_ref": "actor_ref:member_browser_gateway:demo_member",
      "actor_type": "member",
      "device_ref": "device_ref:member_browser_gateway:demo_device",
      "plaintext_identity_forbidden": true,
      "role": "member_role_ref"
    },
    "D2_intent": {
      "primary_intent": "intent_ref:1f72f09916b9ddbc",
      "risk_level": "low",
      "secondary_intent": "redacted_ref:gateway_example",
      "transaction_intent": "browse"
    },
    "D3_state": {
      "browser_state": "dry_run",
      "context_mode": "ref_only",
      "order_state": "none",
      "session_state": "active",
      "task_state": "dry_run"
    },
    "D4_topology": {
      "channel": "browser_action_bus",
      "device_topology": "member_browser_to_total_field",
      "origin_scope": "member_owned",
      "site_ref": "site_ref:xiaoj_member_browser_gateway"
    },
    "D5_resource": {
      "api_refs": [
        "api_ref:member_browser_gateway:local_1b"
      ],
      "cache_policy": "ref_cache_only",
      "cost_policy": "budget_cap_ref",
      "key_policy": "hybrid_ref_only",
      "model_tier": "small",
      "selected_key_ref": "key_ref:member_browser_gateway:broker_default"
    },
    "D6_governance": {
      "allowed_actions": [
        "ask_human_confirm",
        "broker_api_call_ref",
        "cache_lookup_ref",
        "click_ref",
        "close_sidebar_ref",
        "create_order_draft_ref",
        "extract_ref",
        "fill_ref",
        "handoff_to_human",
        "navigate_ref",
        "notify_staff_ref",
        "open_sidebar_ref",
        "queue_service_ref",
        "read_context_ref",
        "read_menu_ref",
        "read_text_ref",
        "render_sidebar_ref",
        "route_to_connector_ref",
        "screenshot_ref",
        "select_ref",
        "wait_ref",
        "write_draft_ref"
      ],
      "forbidden_actions": [
        "login_with_plaintext",
        "submit_payment",
        "submit_order_without_human",
        "read_raw_cookie",
        "read_raw_local_storage",
        "write_database",
        "router_change",
        "tailscale_change",
        "dns_change",
        "service_restart",
        "docker_restart",
        "systemctl_restart"
      ],
      "human_confirm_required": false,
      "no_plaintext_context": true,
      "staff_confirm_required": false
    },
    "D7_verification": {
      "action_allowlist_required": true,
      "leak_check_required": true,
      "redaction_check_required": true,
      "response_verify_required": true,
      "usage_log_required": true
    },
    "D8_envelope": {
      "content_hash": "69a8cc1972d0dd77bf4f8c90d72a26f5ad86af62bcf5546165139e524ae61c3f",
      "counter": 1,
      "created_at": "2026-06-27T10:42:45.714363+00:00",
      "hmac_ref": "hmac_ref:xiaoj_member_browser_1b:verifier_required",
      "nonce": "nonce_ref:46136713b3764be28a3de9d28fa1525f",
      "packet_ref": "packet_ref:xiaoj_member_browser_1b:107a8f849e944d3f",
      "replay_protection": true,
      "schema_version": "8d.packet.v1",
      "signature_ref": "signature_ref:xiaoj_member_browser_1b:verifier_required",
      "ttl_seconds": 300
    },
    "browser_action": {
      "action_ref": "action_ref:xiaoj_member_browser_1b:febddc29dc6045da",
      "action_type": "read_text_ref",
      "dry_run": true,
      "params": {
        "behavior_info_ref": "behavior_ref:90dcbdb548db7d44",
        "benefit_ref": "benefit_ref:community_ai_member_daily",
        "boundary_hits_ref": "risk_ref:140bedbf9c3f6d56",
        "candidate_only": true,
        "cloud_candidate_only": true,
        "cloud_compute_ref": "cloud_compute_ref:local_gateway_safe_stub",
        "controller_ref": "controller_ref:xiaoj_member_browser_1b",
        "generative_transmission_ref": "gt_ref:w7tp_member_browser_gateway_no_plaintext",
        "intent_ref": "intent_ref:1f72f09916b9ddbc",
        "management_fee_bill_ref": "management_fee_bill_ref:none",
        "member_preference_ref": "preference_ref:member:concise",
        "odoo_connector_mode": "ref_only_no_db",
        "odoo_function_item_refs_csv": "odoo_function_ref:resident.notice_read,odoo_function_ref:resident.activity_query,odoo_function_ref:resident.activity_rsvp_candidate,odoo_function_ref:resident.benefit_masked_read,odoo_function_ref:resident.management_fee_masked_read,odoo_function_ref:resident.management_fee_payment_intent_candidate,odoo_function_ref:resident.service_request_draft,odoo_function_ref:resident.personal_status_masked",
        "odoo_function_item_set_ref": "odoo_function_item_set_ref:dd2d1248caedef3c",
        "odoo_function_scope_ref": "odoo_function_scope_ref:member_daily",
        "odoo_identity_ref": "odoo_identity_ref:gateway_demo_member",
        "odoo_member_plaintext_read": false,
        "odoo_permission_bucket_ref": "odoo_permission_bucket_ref:resident_readonly",
        "odoo_role_ref": "odoo_role_ref:resident",
        "odoo_write_authority": false,
        "payment_amount_bucket_ref": "payment_amount_bucket_ref:not_requested",
        "payment_capture_authority": false,
        "payment_data_transferred": false,
        "payment_intent_ref": "payment_intent_ref:d45d7f53e4a252ca",
        "payment_tool_ref": "payment_tool_ref:member_selected_external_tool",
        "public_activity_cache_ref": "public_activity_cache_ref:none",
        "quota_bucket_ref": "quota_bucket_ref:member_browser_gateway:daily",
        "requires_total_field_verify": true,
        "return_packet_schema": "w7tp.cloud_candidate_return_packet.v1",
        "safe_context_ref": "redacted_ref:gateway_example",
        "service_style_ref": "service_style_ref:community_xiaoj_warm_daily"
      },
      "submit_forbidden": true,
      "target_ref": "target_ref:ea555e07a6e251eb"
    },
    "packet_type": "xiaoj_8d_action_packet"
  },
  "association_usage_admission_packet": {
    "D1_identity": {
      "association_ref": "association_ref:wuchang_community_governance",
      "device_ref": "device_ref:member_browser_gateway:demo_device",
      "member_ref": "actor_ref:member_browser_gateway:demo_member",
      "plaintext_identity_forbidden": true
    },
    "D2_intent": {
      "action_type_ref": "action_type_ref:59a21ed3eb0d2c87",
      "consent_scope_ref": "consent_scope_ref:4e12a8d3904f3a42",
      "intent_ref": "intent_ref:1f72f09916b9ddbc",
      "service_scope_ref": "service_style_ref:community_xiaoj_warm_daily"
    },
    "D3_state": {
      "benefit_ref": "benefit_ref:community_ai_member_daily",
      "cloud_candidate_state": "CANDIDATE_READY",
      "gateway_state": "CANDIDATE_READY",
      "management_fee_bill_ref": "management_fee_bill_ref:none",
      "odoo_function_item_set_ref": "odoo_function_item_set_ref:dd2d1248caedef3c",
      "odoo_function_scope_ref": "odoo_function_scope_ref:member_daily",
      "odoo_identity_ref": "odoo_identity_ref:gateway_demo_member",
      "odoo_permission_bucket_ref": "odoo_permission_bucket_ref:resident_readonly",
      "odoo_role_ref": "odoo_role_ref:resident",
      "payment_amount_bucket_ref": "payment_amount_bucket_ref:not_requested",
      "payment_intent_ref": "payment_intent_ref:d45d7f53e4a252ca",
      "payment_tool_ref": "payment_tool_ref:member_selected_external_tool",
      "quota_bucket_ref": "quota_bucket_ref:member_browser_gateway:daily",
      "ttl_seconds": 300
    },
    "D4_evidence": {
      "action_trace_ref": "ACTION_TRACE_REF:b2546302651d8f0a",
      "behavior_info_ref": "BEHAVIOR_INFO_REF:550106b8c394ea28",
      "browser_return_packet_hash": "return_packet_hash:912ef988103e3b6c",
      "cloud_compute_ref": "CLOUD_COMPUTE_REF:5efe273a4ef8645c",
      "cloud_return_packet_hash": "8be31559862010ca8e65c8a8dd4b50ccc224ffd877f95b4cee1ec7330e9e974c",
      "compute_cost_bucket_ref": "COMPUTE_COST_BUCKET_REF:c02be63afee313bf",
      "compute_provider_ref": "CLOUD_PROVIDER_REF:SAFE_LOCAL_STUB",
      "gateway_ref": "gateway_ref:3190e11b6f92312a",
      "member_tendency_ref": "MEMBER_TENDENCY_REF:0e479cfc704c9646",
      "odoo_function_item_refs": [
        "odoo_function_ref:resident.notice_read",
        "odoo_function_ref:resident.activity_query",
        "odoo_function_ref:resident.activity_rsvp_candidate",
        "odoo_function_ref:resident.benefit_masked_read",
        "odoo_function_ref:resident.management_fee_masked_read",
        "odoo_function_ref:resident.management_fee_payment_intent_candidate",
        "odoo_function_ref:resident.service_request_draft",
        "odoo_function_ref:resident.personal_status_masked"
      ],
      "source_packet_hash": "69a8cc1972d0dd77bf4f8c90d72a26f5ad86af62bcf5546165139e524ae61c3f"
    },
    "D5_execution": {
      "admission_decision": "ALLOW",
      "allowed_next_actions": [
        "present_candidate_to_member",
        "ask_member_confirm",
        "route_to_total_field_verifier"
      ],
      "execution_allowed": false,
      "forbidden_actions": [
        "member_plaintext_read",
        "secret_read",
        "raw_api_key_read",
        "oauth_token_read",
        "raw_browser_page_read",
        "db_write",
        "odoo_db_write",
        "pos_write",
        "payment_capture",
        "deploy",
        "service_restart"
      ],
      "human_confirm_required": false,
      "odoo_member_plaintext_read": false,
      "odoo_write_authority": false,
      "payment_capture_authority": false,
      "payment_data_transferred": false
    },
    "D6_generative_transmission": {
      "cloud_candidate_only": true,
      "member_plaintext_transferred": false,
      "no_plaintext_context": true,
      "reconstruction_hint_ref": "RECONSTRUCT_REF:304021f9410acbca",
      "return_mode": "association_no_plaintext_usage_admission",
      "secret_transferred": false
    },
    "D7_risk": {
      "block_required": false,
      "hold_required": false,
      "legal_review_required": false,
      "risk_flags": [
        "candidate_ready"
      ]
    },
    "D8_envelope": {
      "created_at": "2026-06-27T10:42:45.714363+00:00",